{
  "$schema": "https://json-schema.org/draft/2020-12/schema",
  "title": "KDNA Cluster Manifest",
  "description": "Schema for kdna.cluster.json — defines a composable judgment system of KDNA domains.",
  "type": "object",
  "required": ["cluster_id", "name", "version", "domains", "composition"],
  "properties": {
    "cluster_id": {
      "type": "string",
      "description": "Fully qualified cluster identifier, e.g., @company/product-launch-system"
    },
    "name": {
      "type": "string",
      "description": "Human-readable cluster name"
    },
    "version": {
      "type": "string",
      "description": "Semantic version of this cluster manifest"
    },
    "description": {
      "type": "string",
      "description": "What judgment system this cluster provides"
    },
    "type": {
      "type": "string",
      "enum": ["horizontal", "vertical", "governance", "enterprise_system"],
      "description": "Cluster type determining default loading strategy"
    },
    "status": {
      "type": "string",
      "enum": ["draft", "experimental", "stable", "deprecated"]
    },
    "access": {
      "type": "string",
      "enum": ["open", "licensed", "runtime"]
    },
    "domains": {
      "type": "array",
      "items": {
        "type": "object",
        "required": ["id", "version", "role", "required", "load_condition"],
        "properties": {
          "id": {
            "type": "string",
            "description": "Fully qualified domain name (@scope/name)"
          },
          "version": {
            "type": "string",
            "description": "Semver range, e.g., ^1.2.0"
          },
          "role": {
            "type": "string",
            "enum": ["primary", "advisor", "risk_guard", "style_and_trust", "evaluator"]
          },
          "required": {
            "type": "boolean",
            "description": "Whether this domain must load for cluster to function"
          },
          "load_condition": {
            "type": "string",
            "description": "When this domain should activate"
          }
        }
      }
    },
    "relationships": {
      "type": "array",
      "items": {
        "type": "object",
        "required": ["from", "to", "type"],
        "properties": {
          "from": { "type": "string" },
          "to": { "type": "string" },
          "type": {
            "type": "string",
            "enum": ["depends_on", "constrains", "overrides", "blocks", "informs", "extends", "refines", "conflicts_with", "evaluates", "expressed_through"]
          },
          "description": { "type": "string" }
        }
      }
    },
    "composition": {
      "type": "object",
      "required": ["strategy", "conflict_policy", "priority_order"],
      "properties": {
        "strategy": {
          "type": "string",
          "enum": ["fixed", "signal_based", "staged", "overlay", "user_confirmed"]
        },
        "max_active_domains": {
          "type": "integer",
          "minimum": 1
        },
        "default_domains": {
          "type": "array",
          "items": { "type": "string" }
        },
        "conflict_policy": {
          "type": "string",
          "enum": ["surface", "priority", "block", "ask_user"]
        },
        "priority_order": {
          "type": "array",
          "items": { "type": "string" },
          "description": "Ordered list of domain names, highest priority first"
        }
      }
    },
    "token_budget": {
      "type": "object",
      "properties": {
        "max_context_tokens": { "type": "integer" },
        "domain_summary_mode": {
          "type": "string",
          "enum": ["full", "compact", "axioms_only", "scenario_only"]
        },
        "compression_strategy": { "type": "string" }
      }
    },
    "evaluation": {
      "type": "object",
      "properties": {
        "eval_set": { "type": "string" },
        "minimum_pass_rate": { "type": "number", "minimum": 0, "maximum": 1 },
        "required_dimensions": {
          "type": "array",
          "items": { "type": "string" }
        }
      }
    }
  }
}
